CPU:
   0x4ffffffe 0x00: eax=0x00007736 ebx=0x00000000 ecx=0x00000000 edx=0xffffbd0f
CPU:
   0x4ffffffe 0x01: eax=0x0004e3ba ebx=0x00000000 ecx=0x00000001 edx=0xffffbd0f
CPU:
   0x4ffffffe 0x02: eax=0x00000000 ebx=0x00000000 ecx=0x00000002 edx=0xffffbd0f
CPU:
   0x4ffffffe 0x03: eax=0x00000000 ebx=0x00000000 ecx=0x00000000 edx=0x00000000
CPU:
   0x4ffffffe 0x04: eax=0x00000000 ebx=0x00000000 ecx=0x00000000 edx=0x00000000
CPU:
   0x4ffffffe 0x05: eax=0x00000000 ebx=0x00000000 ecx=0x00000000 edx=0x00000000
CPU:
   0x4ffffffe 0x06: eax=0x00000000 ebx=0x00000000 ecx=0x00000000 edx=0x00000000
CPU:
   0x4ffffffe 0x07: eax=0x004c0da5 ebx=0x00000000 ecx=0x00000007 edx=0xffffbd0f
CPU:
   0x4ffffffe 0x08: eax=0x00000000 ebx=0x00000000 ecx=0x00000008 edx=0xffffbd0f
CPU:
   0x4ffffffe 0x09: eax=0x00000000 ebx=0x00000000 ecx=0x00000009 edx=0xffffbd0f
CPU:
   0x4ffffffe 0x0a: eax=0x00022b94 ebx=0x00000000 ecx=0x0000000a edx=0xffffbd0f
CPU:
   0x4ffffffe 0x0b: eax=0x00000000 ebx=0x00000000 ecx=0x00000000 edx=0x00000000
CPU:
   0x4ffffffe 0x0c: eax=0x000e8c47 ebx=0x00000000 ecx=0x0000000c edx=0xffffbd0f
CPU:
   0x4ffffffe 0x0d: eax=0x00000000 ebx=0x00000000 ecx=0x0000000d edx=0xffffbd0f
CPU:
   0x4ffffffe 0x0e: eax=0x00000000 ebx=0x00000000 ecx=0x0000000e edx=0xffffbd0f
CPU:
   0x4ffffffe 0x0f: eax=0x00000000 ebx=0x00000000 ecx=0x0000000f edx=0xffffbd0f
CPU:
   0x4ffffffe 0x10: eax=0x00000000 ebx=0x00000000 ecx=0x00000000 edx=0x00000000
CPU:
   0x4ffffffe 0x11: eax=0x00000000 ebx=0x00000000 ecx=0x00000000 edx=0x00000000
CPU:
   0x4ffffffe 0x12: eax=0x00000000 ebx=0x00000000 ecx=0x00000012 edx=0xffffbd0f
CPU:
   0x4ffffffe 0x13: eax=0x00000000 ebx=0x00000000 ecx=0x00000013 edx=0xffffbd0f
CPU:
   0x4ffffffe 0x14: eax=0x00000000 ebx=0x00000000 ecx=0x00000014 edx=0xffffbd0f
CPU:
   0x4ffffffe 0x15: eax=0x00000000 ebx=0x00000000 ecx=0x00000015 edx=0xffffbd0f
CPU:
   0x4ffffffe 0x16: eax=0x00000000 ebx=0x00000000 ecx=0x00000016 edx=0xffffbd0f
CPU:
   0x4ffffffe 0x17: eax=0x00000000 ebx=0x00000000 ecx=0x00000017 edx=0xffffbd0f
CPU:
   0x4ffffffe 0x18: eax=0x00000000 ebx=0x00000000 ecx=0x00000018 edx=0xffffbd0f
CPU:
   0x4ffffffe 0x19: eax=0x00000000 ebx=0x00000000 ecx=0x00000019 edx=0xffffbd0f
CPU:
   0x4ffffffe 0x1a: eax=0x00000000 ebx=0x00000000 ecx=0x0000001a edx=0xffffbd0f
CPU:
   0x4ffffffe 0x1b: eax=0x00000000 ebx=0x00000000 ecx=0x0000001b edx=0xffffbd0f
CPU:
   0x4ffffffe 0x1c: eax=0x0000de40 ebx=0x00000000 ecx=0x0000001c edx=0xffffbd0f
CPU:
   0x4ffffffe 0x1d: eax=0x00000004 ebx=0x00000000 ecx=0x0000001d edx=0xffffbd0f
CPU:
   0x4ffffffe 0x1e: eax=0x0008cafb ebx=0x00000000 ecx=0x0000001e edx=0xffffbd0f
CPU:
   0x4ffffffe 0x1f: eax=0x00000820 ebx=0x00000000 ecx=0x0000001f edx=0xffffbd0f
CPU:
   0x4ffffffe 0x20: eax=0x0053335b ebx=0x00000000 ecx=0x00000020 edx=0xffffbd0f
CPU:
   0x4ffffffe 0x21: eax=0x00000000 ebx=0x00000000 ecx=0x00000000 edx=0x00000000
CPU:
   0x4ffffffe 0x22: eax=0x00000000 ebx=0x00000000 ecx=0x00000000 edx=0x00000000
CPU:
   0x4ffffffe 0x23: eax=0x00000000 ebx=0x00000000 ecx=0x00000000 edx=0xffffffff
CPU:
   0x4ffffffe 0x24: eax=0x00000000 ebx=0x00000000 ecx=0x00000024 edx=0xffffbd0f
CPU:
   0x4ffffffe 0x25: eax=0x00000000 ebx=0x00000000 ecx=0x00000025 edx=0xffffbd0f
CPU:
   0x4ffffffe 0x26: eax=0x00000000 ebx=0x00000000 ecx=0x00000000 edx=0xffffffff
CPU:
   0x4ffffffe 0x27: eax=0x00000000 ebx=0x00000000 ecx=0x00000027 edx=0xffffbd0f
CPU:
   0x4ffffffe 0x28: eax=0x00003027 ebx=0xc940b6a0 ecx=0x00000028 edx=0xffff94a3
CPU:
   0x4ffffffe 0x29: eax=0x00000000 ebx=0x00000000 ecx=0x00000029 edx=0xffffbd0f
CPU:
   0x4ffffffe 0x2a: eax=0x00000000 ebx=0x00000000 ecx=0x00000000 edx=0xffffffff
CPU:
   0x4ffffffe 0x2b: eax=0x00000000 ebx=0x00000000 ecx=0x0000002b edx=0xffffbd0f
CPU:
   0x4ffffffe 0x2c: eax=0x00000016 ebx=0x00000000 ecx=0x0000002c edx=0xffffbd0f
CPU:
   0x4ffffffe 0x2d: eax=0x00000000 ebx=0x00000000 ecx=0x0000002d edx=0xffffbd0f
CPU:
   0x4ffffffe 0x2e: eax=0x00000000 ebx=0x00000000 ecx=0x0000002e edx=0xffffbd0f
CPU:
   0x4ffffffe 0x2f: eax=0x00000000 ebx=0x00000000 ecx=0x0000002f edx=0xffffbd0f
CPU:
   0x4ffffffe 0x30: eax=0x0011ad96 ebx=0x00000000 ecx=0x00000030 edx=0xffffbd0f
CPU:
   0x4ffffffe 0x31: eax=0x0004978e ebx=0x00000000 ecx=0x00000031 edx=0xffffbd0f
CPU:
   0x4ffffffe 0x32: eax=0x00000000 ebx=0x00000000 ecx=0x00000032 edx=0xffffbd0f
CPU:
   0x4ffffffe 0x33: eax=0x00000000 ebx=0x00000000 ecx=0x00000000 edx=0x00000000
CPU:
   0x4ffffffe 0x34: eax=0x0001734f ebx=0x00000000 ecx=0x00000034 edx=0xffffbd0f
CPU:
   0x4ffffffe 0x35: eax=0x00000000 ebx=0x00000000 ecx=0x00000035 edx=0xffffbd0f
CPU:
   0x4ffffffe 0x36: eax=0x00000014 ebx=0x00000000 ecx=0x00000036 edx=0xffffbd0f
CPU:
   0x4ffffffe 0x37: eax=0x00000006 ebx=0x00000000 ecx=0x00000037 edx=0xffffbd0f
CPU:
   0x4ffffffe 0x38: eax=0x00000000 ebx=0x00000000 ecx=0x00000038 edx=0xffffbd0f
CPU:
   0x4ffffffe 0x39: eax=0x00000000 ebx=0x00000000 ecx=0x00000039 edx=0xffffbd0f
CPU:
   0x4ffffffe 0x3a: eax=0x00000000 ebx=0x00000000 ecx=0x0000003a edx=0xffffbd0f
CPU:
   0x4ffffffe 0x3b: eax=0x00000000 ebx=0x00000000 ecx=0x0000003b edx=0xffffbd0f
CPU:
   0x4ffffffe 0x3c: eax=0x00000000 ebx=0x00000000 ecx=0x0000003c edx=0xffffbd0f
CPU:
   0x4ffffffe 0x3d: eax=0x00000000 ebx=0x00000000 ecx=0x0000003d edx=0xffffbd0f
CPU:
   0x4ffffffe 0x3e: eax=0x00000000 ebx=0x00000000 ecx=0x0000003e edx=0xffffbd0f
CPU:
   0x4ffffffe 0x3f: eax=0x00000000 ebx=0x00000000 ecx=0x00000000 edx=0x00000000
CPU:
   0x4ffffffe 0x40: eax=0x00000000 ebx=0x00000000 ecx=0x00000000 edx=0x00000000
CPU:
   0x4ffffffe 0x41: eax=0x00000000 ebx=0x00000000 ecx=0x00000000 edx=0xffffffff
CPU:
   0x4ffffffe 0x42: eax=0x00000000 ebx=0x00000000 ecx=0x00000000 edx=0x00000000
CPU:
   0x4ffffffe 0x43: eax=0x00000000 ebx=0x00000000 ecx=0x00000043 edx=0xffffbd0f
